{
  "journal_digest": "f4da139a903753742d5e8410107fa4cdfda69e6c9fa823dc70bea445e2837c6c",
  "journal_id": "a7-journal:10000000-0000-4000-8000-000000000725",
  "next_state": {
    "packet_digest": "bd78b868bba0f73f5dd64042a3ca9371b92350930016d23af310b47c828fc915",
    "packet_id": "a7-packet:10000000-0000-4000-8000-000000000710",
    "schema_version": 1,
    "state_digest": "10ca16a3ab4de5f6cacd875b367f99942607371f3e27844d6c945407ca994b9d",
    "state_revision": 1,
    "synthetic_project_id": "v2-fixture",
    "targets": [
      {
        "content_digest": "1153ab362016645ea4581e933835f994375d7322f6e994ee462b741e41518a76",
        "synthetic_project_id": "v2-fixture",
        "target_id": "a7-target:10000000-0000-4000-8000-000000000701",
        "target_revision": 8
      },
      {
        "content_digest": "3a542c09504da27bd3c99fa1988c43f6b0d3e09cc0165a44486eecd4d3667d7c",
        "synthetic_project_id": "v2-fixture",
        "target_id": "a7-target:10000000-0000-4000-8000-000000000702",
        "target_revision": 12
      }
    ]
  },
  "operation": "canary",
  "packet_digest": "bd78b868bba0f73f5dd64042a3ca9371b92350930016d23af310b47c828fc915",
  "packet_id": "a7-packet:10000000-0000-4000-8000-000000000710",
  "previous_state": {
    "packet_digest": "bd78b868bba0f73f5dd64042a3ca9371b92350930016d23af310b47c828fc915",
    "packet_id": "a7-packet:10000000-0000-4000-8000-000000000710",
    "schema_version": 1,
    "state_digest": "2ad39785da38e051964a687889f85b9f4727b51361e7b61931a904f67aa91584",
    "state_revision": 0,
    "synthetic_project_id": "v2-fixture",
    "targets": [
      {
        "content_digest": "1ecc5c1a3329d4bc7b79570d869ed34b1ed2828be5f2de393a74a2c305e726b0",
        "synthetic_project_id": "v2-fixture",
        "target_id": "a7-target:10000000-0000-4000-8000-000000000701",
        "target_revision": 7
      },
      {
        "content_digest": "e3efc5e854084244be1e1d3e8986c1cd47a4f5401833571d532e0e8e106f18c1",
        "synthetic_project_id": "v2-fixture",
        "target_id": "a7-target:10000000-0000-4000-8000-000000000702",
        "target_revision": 11
      }
    ]
  },
  "receipt": {
    "authority_write": false,
    "backup_digest": "ccb48ea1b12fbee51a3a7b4b22d6ed7aa4de1a62d35a08e3a0b4c065649b5545",
    "backup_id": "a7-backup:10000000-0000-4000-8000-000000000720",
    "created_at": "2026-07-24T09:00:00Z",
    "expected_state_revision": 0,
    "fixture_only": true,
    "global_mutation": false,
    "global_target_access": false,
    "network_calls": 0,
    "operation": "canary",
    "packet_digest": "bd78b868bba0f73f5dd64042a3ca9371b92350930016d23af310b47c828fc915",
    "packet_id": "a7-packet:10000000-0000-4000-8000-000000000710",
    "previous_state_revision": 0,
    "receipt_digest": "e5085ddefaca6afac33abbdc0656bcdb46538995293d198a56ddeabd76e85bf9",
    "receipt_id": "a7-rollout-receipt:10000000-0000-4000-8000-000000000722",
    "schema_version": 1,
    "state_revision": 1,
    "status": "CANARY_APPLIED_SYNTHETIC",
    "synthetic_project_id": "v2-fixture",
    "target_states": [
      {
        "content_digest": "1153ab362016645ea4581e933835f994375d7322f6e994ee462b741e41518a76",
        "synthetic_project_id": "v2-fixture",
        "target_id": "a7-target:10000000-0000-4000-8000-000000000701",
        "target_revision": 8
      },
      {
        "content_digest": "3a542c09504da27bd3c99fa1988c43f6b0d3e09cc0165a44486eecd4d3667d7c",
        "synthetic_project_id": "v2-fixture",
        "target_id": "a7-target:10000000-0000-4000-8000-000000000702",
        "target_revision": 12
      }
    ]
  },
  "schema_version": 1,
  "synthetic_project_id": "v2-fixture"
}
